1	001	164040	 Aca tiene una lista por si les sirve de ayuda Pasar mucho tiempo pensando en el juego como experiencias pasadas o formas de conseguir más dinero con que jugar Necesidad de apostar cantidades cada vez más grandes de dinero para sentir excitación Haber tenido muchos intentos infructuosos por jugar menos o dejar de jugar Sentirse inquieto o irritable al tratar de jugar menos o dejar de jugar Jugar para escapar de los problemas o de sentimientos de tristeza o ansiedad Apostar mayores cantidades de dinero para intentar recuperar las pérdidas previas Mentir sobre la cantidad de tiempo o dinero gastada en el juego Cometer delitos para conseguir dinero para jugar Perder el trabajo una relación u oportunidades en sus estudios o en su carrera debido al juego Necesidad de pedir dinero prestado para sobrevivir debido a las pérdidas ocasionadas por el juego
1	002	344327	En el que puso SUSANA solo me encuentro algo identificado en Hay preocupación por el juego pasa mucho tiempo pensando en el juego como experiencias pasadas o formas de conseguir más dinero con que jugar Intentos repetidos e infructuosos por jugar menos o dejar de jugar Y me explico me preocupo porque se que si no lo corto me puede llevar a un gran problema Lo he dejado 2 veces y luego he vuelto porque me apetecio aunque despues me senti rastrero 
1	003	130231	Él es un enfermo un ser pasivo que padece una dolencia como cualquier otra como la diabetes por ejemplo Que yo sepa nunca nadie que ha transpasado la barrera de jugador patologico a los juegos de apuestas a conseguido volver al estado de jugador social que juega segun su conveniencia parando ante unas perdidas que tenia ya pensadas y marchandose a su casa con el dinero restante como si aqui no hubiera pasado nada 
1	004	266234	Cuando ya no tenia dinero para jugar a la tragaperras me seguia jugando el puesto de trabajo la relacion de trabajo la pareja y demas relaciones personales por jugar con el movil e incluso por hacer sudokus buscaba de cualquier modo eludir el mundo real y en caso de no tener dinero mi mundo de fantasia se encontraba en el menu de juegos del movil o en un libro de pasatiempos crucigramas sudokus dameros cualquier cosa con tal de no enfrentarme a la vida y sus problemas 
1	005	24471	Describes a menudo con prolijidad tus experiencias pasadas de como jugabas y cómo hiciste para dejar de jugar nos cuentas cómo jugaste durante casi toda tu vida y el juego te hacía hacer y pensar en cosas que no entendías por desconocimiento de la adicción hace ya varios años que sabes lo que sucedió y con tu método conseguiste dejar de jugar pero no has logrado dejar de pensar en el juego un solo día de tu vida 
1	006	249324	Tendrás que conseguir que dejen de estar enfadados tus hermanos y esperar a la próxima oportunidad que pidan dinero para decir el sí os queremos pero no podemos seguir financiando el juego y no os ayudamos para que sigáis jugando y os hundáis y nos estaféis venid aquí id allí haced esto y lo otro con nosotros pero hacemos control del dinero y os ponéis en tratamientote si no queréis ahora no pasa nada os seguimos queriendo y esperando a que queráis la ayuda que podemos daros 
1	007	88774	el juego juego es y el que pueda jugar controladamente hace bien en emplear su dinero y su tiempo en lo que mejor le parezca pero el ludopata no puede jugar porque pierde todo control juega convulsivamente y deja otras actividades por el descontrol del juego no hay que demonizar al juego otro tema distinto es la agresividad que emplean los empresarios del juego para atraer clientes de todas folma yo ya era ludopata en tiempo de Franco y entoces el juego estaba prohibido o por lo menos no estaba tan estendido como ahora asi pues no creo que una prohibicion solucionase nada tal vez una mejor regulacion y sobre todo mas medios para los que nos hacemos ludopatas poder seguir tratamientos adecuados__________________ vencer la ludopatia1º aceptacion 2º convencimiento 3ºresolusion y tratamiento
1	008	165649	si cuando juegas es para cubrir las perdidas del dia anterior si cuando entras en un salon de juegos toda tu obsesion es ponerte a jugar sin pensar en las consecuencias si has dejado cosas importantes por hacer para jugar eres ludopata aunque todabia este a tiempo de no desarrollar mas tu enfermedad aunque las consecuencias economicas no sean graves preguntate porque cojes la tarjeta y pones dinero en un juego y no te compras lo que quieras verdad que es curioso
1	009	321843	 estas entrando en una etapa de juego que en mi experiencia es donde la enfermedad empieza a hacerce fuerte porque a pesar de notar que algo no esta bien seguis jugando hasta llegar al descontrol total por ese motivo debes cortar esto lo antes posible Lei que te estas informando lee todo lo que puedas y sigue todas la reglas porque son importantisimas sobre todo lo de que alguien controle el dinero el que hables con tu mujer va a ser lo mejor ella es quien te acompaña en la vida amigo ella es quien te ama Buscale la vuelta lo mas importante es que realmente estes convecido y firme en dejar de jugar Un abrazo mucho mucho animo y te sigo leyendo Daniel Argentina mas de 1 mes y medio sin jugar
1	010	160537	El juego se basa en estímulos por mucho que yo esté segura que no voy a jugar si llevo dinero cualquier estímulo puede cambiar mi destino Porque como jugadores de máquinas nos han pasado experiencias que vemos pensamos que nos van a salvar la vida Ves a otro jugador perdiendo mucho y quieres cazar su pérdida Y si entras otra vez en el juego lo perderás todo porque ya no te paras vas de máquina en máquina y cuando te des cuenta estarás otra vez sacando de tu targeta de crédito mintiendo y haciendote daño a ti y a tu familia 
2	001	344297	La Asociación Americana de Psiquiatría American Psychiatric Association define a la ludopatía como una entidad que consta de cinco o más de los siguientes síntomas Hay preocupación por el juego pasa mucho tiempo pensando en el juego como experiencias pasadas o formas de conseguir más dinero con que jugar Necesidad de apostar cantidades cada vez más grandes de dinero para sentir excitación Intentos repetidos e infructuosos por jugar menos o dejar de jugar Inquietud o irritabilidad cuando itenta jugar menos o dejar de jugar Jugar para escapar de los problemas o de sentimientos de tristeza o ansiedad Intentar recuperar las pérdidas apuesta mayores cantidades de dinero para intentar recuperar las pérdidas previas Mentir sobre la cantidad de tiempo o dinero gastada en el juego Cometer crímenes para conseguir dinero para el juego Pérdida del trabajo relaciones importantes u oportunidades en sus estudios o en su carrera debida al juego Necesidad de pedir dinero prestado para sobrevivir debido a las pérdidas ocasionadas por el juego Lo saque de esta página hay otras cosas que pueden interesarte Dirección de esta página http www nlm nih gov medlineplus spanish ency article 0015 20__________________24 hs 
2	002	164040	 Aca tiene una lista por si les sirve de ayuda Pasar mucho tiempo pensando en el juego como experiencias pasadas o formas de conseguir más dinero con que jugar Necesidad de apostar cantidades cada vez más grandes de dinero para sentir excitación Haber tenido muchos intentos infructuosos por jugar menos o dejar de jugar Sentirse inquieto o irritable al tratar de jugar menos o dejar de jugar Jugar para escapar de los problemas o de sentimientos de tristeza o ansiedad Apostar mayores cantidades de dinero para intentar recuperar las pérdidas previas Mentir sobre la cantidad de tiempo o dinero gastada en el juego Cometer delitos para conseguir dinero para jugar Perder el trabajo una relación u oportunidades en sus estudios o en su carrera debido al juego Necesidad de pedir dinero prestado para sobrevivir debido a las pérdidas ocasionadas por el juego
2	003	193760	Buenas noches mujerde Habla nuevamente con él muéstrale como cada vez va a más la adicción con hechos cantidades hojas de la cartilla del banco si tienes sospecha que le haya podido pedir a alguien dinero averígualo Explícale que hay mucha gente que lo acaba perdiendo todo porque cada vez apostará más y más para recuperar y que esa no es la forma ni de recuperar dinero ni de recuperar la relación y que tarde o temprano no podrás aguantar la situación y que no quieres que ese día llegue todo depende de si acude a una asociación donde le pueden ayudar 
2	004	106516	yo les apuesto que si hubiese un sitio donde uno va y le cortan un brazo siempre uno no vuelve jamás aca nos cortamos la vida sufrimos lloramos nos lamentamos no dormimos etc y seguimos yendo solo porque como siempre he dicho nos gusta el dinero facil la soledad fantasear y tenemos una ausencia de adrenalina que la buscamos alli apostando cada vez mas para despertar nuevas emociones 
2	005	83491	El adicto al juego necesita ir aumentando cada vez más tiempo y dinero en apuestas para equilibrar su balance Otra consecuencia es la falta de control cuando se está apostando Tu cabeza te pedía haber apostado 5 y terminaste apostando 32 no pudiste parar con 5 perdidos 
2	006	83521	El adicto al juego necesita ir aumentando cada vez más tiempo y dinero en apuestas para equilibrar su balance Otra consecuencia es la falta de control cuando se está apostando Tu cabeza te pedía haber apostado 5 y terminaste apostando 32 no pudiste parar con 5 perdidos 
2	007	259602	Y esto explica el por què uno tiende a incrementar la cantidad de dinero en cada apuesta porque como cualquier droga se da el efecto de tolerancia es decir necesito cada vez màs droga para conseguir el mismo efecto de excitaciòn 
2	008	180432	Cada vez que consigo una cantidad de dinero importante más de cien euros siento la necesidad irrefrenable de jugar detecto los sintomas pero mi mente se bloquea y no dejo de jugar hasta que lo pierdo todo 
2	009	73902	la primera vez que fui gane empece a ir los fines de semana y acabe yendo cada día al principio apostaba poco y unos días ganaba y otros perdía mira el juego es una actividad ludica en el caso de los juegos de apuestas ademas interviene la sensacion de poder dar un pelotazo todo esto hace que el juego de apuestas nos sea muy agradable pero tambien es muy adictivo y cuando llegamos a un punto de adicion entoces el juego se convierte en una tortura porque ya no podemos controlar ni el tiempo ni la cantidad de dinero da igual que ganemos o perdamos la adiccion hace que queramos jugar mas y mas mientras ganamos perdemos va equilibrado no dejamos de jugar cuando las perdidas hacen que no podamos jugar entoces pasamos a la busqueda de dinero llegamos a condicionar toda nuestra vida al juego por tu relato estas en las puertas tienes que decidir si entras o no si no entras y lo deja tal y como esta no te habra quitado mas que esa cantidad que puedes pensar que has gastado en cualquier otra cosa y pasar pagina si entras te volveremos a ver por aqui tratando de salir y el pobrema es que la entrada la tienes muy facil pero la salida es muy dificil ironia cuando entras en una compañia telefono movil todo son facilidades pero cuando quieres salir es muy complicado pues algo similar pero mucho mas grave solo tengo 500 euros y solo pienso en recuperar esos 3 500 euros que e perdido de mis ahorros usa los 500 en una buena fiesta y quedate con ese recuerdo__________________ vencer la ludopatia1º aceptacion 2º convencimiento 3ºresolusion y tratamiento
2	010	144927	El enfermo necesita cada vez emplear más dinero y tiempo Como puede llegar una persona adinerada a no tener ni para comer Debido a que emplea cada vez más dinero en juego a causa de la tolerancia comentada en la respuesta anterior Como se pueden abrir los ojos de un enfermo del juego para que vea mas alla de las maquinas Forzándole a que acuda a una asociación con profesionales donde le hagan un diagnóstico y le prescriban el tratamiento 
3	001	337313	 El dejar de jugar o reducir cuánto usted jugaba le ha hecho sentir inquieto o irritable durante los últimos 12 meses 
3	002	285226	Pues intentamos seguir unas pautas las respetamos os somos sinceros pero esque cualquier cambio de humor un comentario que no sienta bien dejarse un boton de la camisa sin anudar esque cualquier situacion incomprendida por los familiares necesariamente a de querer decir que hemos vuelto a jugar o que no lo hemos dejado de hacer 
3	003	285199	Pues intentamos seguir unas pautas las respetamos os somos sinceros pero esque cualquier cambio de humor un comentario que no sienta bien dejarse un boton de la camisa sin anudar esque cualquier situacion incomprendida por los familiares necesariamente a de querer decir que hemos vuelto a jugar o que no lo hemos dejado de hacer 
3	004	25334	Si ha vuelto a jugar habiéndose propuesto que lo dejaría No se avergüence porque es normal que le ocurra usted es responsable de jugar o no jugar al iniciarse en el juego pero no se culpabilice de la enfermedad determinados juegos tienen un potencial adictivo del que las autoridades y la prensa poco han informado 
3	005	38292	Si ha vuelto a jugar habiéndose propuesto que lo dejaría No se avergüence porque es normal que le ocurra usted es responsable de jugar o no jugar al iniciarse en el juego pero no se culpabilice de la enfermedad determinados juegos tienen un potencial adictivo del que las autoridades y la prensa poco han informado 
3	006	43763	Si ha vuelto a jugar habiéndose propuesto que lo dejaría No se avergüence porque es normal que le ocurra usted es responsable de jugar o no jugar al iniciarse en el juego pero no se culpabilice de la enfermedad determinados juegos tienen un potencial adictivo del que las autoridades y la prensa poco han informado 
3	007	111131	Referente a lo de intentarlo dejarlo solo la verdad es que llevo desde el 13 sin jugar desde que decidí dejarlo siempre he llevado una vida muy a la locura drogas alcohol vicio pero decidí hace tiempo acabar con todo eso pero no pude dejar las malditas traga perras desde que leí las normas básicas no he vuelto a pisar el bar y si me gustaría hacerme socio de una asociación pero solo como en alcoholicos anónimos o algo así pero comprendo que no se puede que tienes que ir acompañado 
3	008	164040	 Aca tiene una lista por si les sirve de ayuda Pasar mucho tiempo pensando en el juego como experiencias pasadas o formas de conseguir más dinero con que jugar Necesidad de apostar cantidades cada vez más grandes de dinero para sentir excitación Haber tenido muchos intentos infructuosos por jugar menos o dejar de jugar Sentirse inquieto o irritable al tratar de jugar menos o dejar de jugar Jugar para escapar de los problemas o de sentimientos de tristeza o ansiedad Apostar mayores cantidades de dinero para intentar recuperar las pérdidas previas Mentir sobre la cantidad de tiempo o dinero gastada en el juego Cometer delitos para conseguir dinero para jugar Perder el trabajo una relación u oportunidades en sus estudios o en su carrera debido al juego Necesidad de pedir dinero prestado para sobrevivir debido a las pérdidas ocasionadas por el juego
3	009	321663	Hoy hace 5 días que decidí dejar de jugar 5 días de poder mirar a mi mujer a los ojos sin remordimientos 5 días de no estar inquieto 5 días sin prisas por salir corriendo a jugar 5 días en los que he vuelto a descubrir que para tomar un café no hacen falta 3 horas 5 días sin oler a tabaco y fritura 5 días sin los dedos negros por las monedas 5 días de felicidad 
3	010	177353	Creo que todos hemos intentado dejar de jugar algunos con mas exitos que otros pero siempre hemos vuelto a jugar siempre con la misma permisa a ver si saco el premio y pago a este o aquel otro que le debo 
4	001	251596	Para que es más de lo mismo pensar solo en ti de malo no en los que haces sufrir en tu sufrimiento sin fin pero olvidando lo inteligente que puedes ser lo sincero lo amable lo cariñoso lo feliz que puedes ser con los que te quieren o los que te querrán cuando dejes de jugar de encerrarte de engañar mejor vivir resolver los problemas esforzarse recuperar y enseñar tu dignidad y tu tranquilidad cada dia un poco sin prisa pero sin pausa con placidez como sale la inmensa mayoría de las personas que están en tu situación aunque ahora la mayoría estén de vacaciones y no te puedan apoyar un poco más ya que estás en el foro deja que te acompañemos ya lo dabas todo por perdido y resulta que si dejas de jugar dinero lo tienes todo por ganar A ver si la próxima ya te sientes mejor __________________
4	002	93564	Ten en cuenta una cosa seguramente ella sea consciente del problema otra cosa es que ya no quiera saber nada de curarse los ludopatas nos solemos culpar y mucho estamos deprimidos y supongo que cuando llevas mucho tiempo jugando te haces asi agrio sin sentimientos ya no te importa si pierdes o ganas haces una barrera para la malo que conlleva el jugar y asumes el juego como parte de tu vida 
4	003	181328	Después de jugar viene la segunda parte y es que nos mientes constantemente nos metes unosrollos que ni tu mismo cuando nos los estás contando te lo puedes creer El dinero no está para malgastarlo en el juego pues lo único que se hace es enriquecer a otros y arruinar familias y no sólo economicamente ya que para un Adicto al juego una máquina es más importante que su familia y que él mismo 
4	004	171735	Después de jugar viene la segunda parte y es que nos mientes constantemente nos metes unosrollos que ni tu mismo cuando nos los estás contando te lo puedes creer El dinero no está para malgastarlo en el juego pues lo único que se hace es enriquecer a otros y arruinar familias y no sólo economicamente ya que para un Adicto al juego una máquina es más importante que su familia y que él mismo 
4	005	153668	Después de jugar viene la segunda parte y es que nos mientes constantemente nos metes unosrollos que ni tu mismo cuando nos los estás contando te lo puedes creer El dinero no está para malgastarlo en el juego pues lo único que se hace es enriquecer a otros y arruinar familias y no sólo economicamente ya que para un Adicto al juego una máquina es más importante que su familia y que él mismo 
4	006	168218	bueno yo sigo en mis treces yo he jugado cuando estaba insastifecho y tambien cuando me sentia feliz y cuando tenia problemas economicos y tambien cuando no los tenia el problema es el no poder jugar cuando y como queremos somos esclavos del juego nos anula por completo desarrollamos toda nuestras actividades en funcion del juego nos convertimos en sus esclavos los problemas economicos y de otra indoles que nos provocas son circunstanciales le realidad es que llegamos a un punto que nuestra autentica batalla es poder jugar y parar a voluntad y como vemos que nos resulta imposible mantenemos una lucha feroz con nosotros mismo no somos capaces de aceptar que eso tan absurdo nos pueda dominar por eso digo que realmente para empezar a ganar debemos de aceptar la derrota no podenos vencer al juego no somos capaces de jugar a voluntad propia tenemos que aceptar que si queremos desarrollar una vida donde seamos capaces de tomar desiciones y llevarlas a cabo tenemos que dejar de jugar si jugamos el juego anula nuestra voluntad porque esto es asi lo ignoro no se porque yo no puedo jugar sin ser dominado por el juego pero si se que cuando juego el juego domina toda mi vida y nada de lo que me propongo lo llevo a cabo bien por el estado animico al que me lleva o bien por la serie de problemas que me causa asi pues lo dicho en mi caso el inicio a una vida mas o menos sastifactoria ha pasado por la aceptacion de la derrota he aceptado que estoy totalmente incapacitado para jugar las ganas o deseos de jugar me invadian mientras en mi interior quedaban dudas de si seria o no capaz de jugar sin ser dominado una vez aceptado que soy incapaz de jugar sin que eso me suponga una anulacion de mi voluntad todo me ha sido facil ya no siento deseos de jugar incluso hay veces que dispongo de dinero y tiempo por lo que podria ir a jugar pero se sin el menor genero de dudas que ese acto me llevara a un descontrol total y por lo tanto ni me lo planteo ya se que lo que pretendes es buscar una explicacion a porque somos dominados pero creo que realmente no hay dicha explicacion es posible que sea cuestion psicologica u psiquiatrica pero aqui la mayoria somos simplemente enfermos de esta enfermedad que lo que perseguimos es vencerla mas que entenderla por eso reitero en mi caso cuando deje de resistirme a la realidad de que el juego a mi me dominaba y por tanto debia de presindir de el me ha resultado facil aprender a vivir sin nesecidad de jugar se que tengo una enfermedad y se como convatirla creo que es suficiente no nesecito saber como se desarrolla con saber como actua me ha bastado y he aceptado que no puedo vencerla recordad que siempre decimos que es incurable presisamente si descubrieramos como se desarrolla empezariamos a encontrar la curacion pero creo que ninguno de los que estamos aqui estamos capacitado para llegar o marcarnos esa meta asi pues conformemonos con convertirla en una enfermedad cronica que con su tratamiento renunciar al juego nos permite llevar una vida totalmente plena no estoy en contra de tu busqueda amigo Jaime si no fuera porque esa osebsion del mporque te lleva de folma periodica ha hacer pruevas las cuales te llevan a graves recaidas asi pues te recomiendo que asimiles que es una batalla perdida que tu no estas capacitado para encontrar el remedio que lo unico que puedes hacer es asimilar que has de vivir sin juego un abrazo__________________ vencer la ludopatia1º aceptacion 2º convencimiento 3ºresolusion y tratamiento
4	007	347770	Me di cuenta que tenía un problema cuando iba a jugar al casino y no podía parar de hacerlo hasta que me jugaba todo el pago del mes esto me sucedió varias veces continuas y no paraba porque quería dejar de hacerlo sino por el hecho de no tener más dinero después de unos días deprimido me di cuenta de que tenía un problema grave busqué información en internet y comprendí lo maligno de mi comportamiento y que era autodestructivo decidí buscar ayuda actualmente estoy con un psicólogo y con medicación aquí en mi país creo que no hay grupos de apoyo y cifro mis esperanzas en la fluoxetina el doctor me dice que la tengo que tomar por 6 meses diario y luego ir bajando la dosis los otros 6 meses para al acabo de un año dejar de tomarla y ver si el cerebro desprogramó las ansias por el juego el problema en mi país Costa Rica parece ser nuevo o escaso el boom de los casinos comenzó hace unos 10 años y las entidades de asistencia social no tienen programas formales para combatir esta plaga 
4	008	316482	ESTO VA POR TI CHAMY YO EMPECE A JUGAR A LAS MAKINAS XK NO ME VALORABA A MI MISMO PARA NADA POR ESO ME GUSTABA JUGAR Y APARTE YO CREIA K ASI TENIA AMIGOS XK KERIA COMPRAR A LA JENTE APARTE K YO TENIA PROBLEMAS EN CASA CON MI PADRE ME DECIAN UNA Y OTRA VEZ K YO NO LLEGARIA A NADA K ERA TONTO K ERA MEJOR K ME TIRARA X UN PUENTE K MI VIDA ERA UNA MIERDA K TODO LO K HACIA NO VALIA PARA NADA YO ME LO CREIA POR ESO CHAMY SE COMO TE SIENTES SE K ESTAS MAL POR ESO TE METO CAÑA NO PARA JODERTE SI NO PARA AYUDARTE OK
4	009	216897	El problema es que yo aparte de mi sueldo que para unchaval de 20 años no se puede considerar pequeño unos 1200 aproximadamente tengo otros ingresos de otras fuentes no penseis mal no es de dorgas ni de robos ni nada por el estilo si no que por otros medios cada fin de semana gano unos 100 200 facilmente con una actividad relacionada con el fútbol por eso al verme con bastante idnero jugaba algo pero siempre como una diversión y nunca llegue a quedarme sin dinero ni sin los ahorros ni mucho menos 
4	010	344368	Soy nuevo en el foro Durante el último mes he tenido problemas muy graves me he jugado el dinero de mi salario completamente los dos últimos meses cuando estaba en la mesa jugando me olvidé de mis cuentas y obligaciones no me acordaba de nada me he sentido muy mal y deprimido cuando empecé a jugar en los casinos hace 7 años me sentía muy bien y tenía mucho control 7 años después ya no tengo ese control actualmente mi esposa me está ayudando económica y emocionalmente aunque dice que no sabe hasta cuando podrá hacerlo esta situación me da vergüenza he buscado ayuda psicológica actualmente estoy con un medicamento fluoxetina que me ha aliviado enormemente la obsesión por el juego tengo 5 días de no jugar espero poder continuar así por el bien mío el de mi esposa y el de mi hija 
5	001	340512	Si despues de eso vuelve a perder incrementa la perdida pero si gana lo vuelve a apostar asi que en definitiva las perdidas son perdidas y las ganancias van destinadas a seguir jugando en raras ocasiones normalmente por culpabilidad o intentar hacer ver que no tenemos problemas economicos se puede utilizar el dinero de la ganancia para otros fines pero en definitiva lo que te da la maquina vuelve a la misma o a otra 
5	002	51207	El otro día después de perder una cantidad de dinero empecé a contarle a mi mujer una mentira para justificar ese gasto y ahí me derrumbé 
5	003	167186	Primero me di cuenta de que siempre seguiria perdiendo dinero y luego me di cuenta de lo vacio que era estar en el casino una y otra vez pegado a una mesa hasta que ya no me quedaba dinero para apostar me estaba conviertiendo en una persona obsesiva vacia depresiva y asocial Lo cierto es que un dia tuve la fuerza de voluntad para inscribirme en el registro de personas a las que se prohibe el acceso a los bingos y desde entonces no he vuelto a pisar un bingo 
